id,text,category
2610,Why did I have to pay an additional amount when using my card to pay?,card_payment_fee_charged
2611,I paid with my card and I was charged a fee,card_payment_fee_charged
2612,There was a charge applied when I used my card.,card_payment_fee_charged
2613,I was charged a hidden fee when I paid with card.,card_payment_fee_charged
2614,Why does it cost more to pay with my card?,card_payment_fee_charged
2615,Is there a place to check for fee for payments? I feel like I'm getting charged too much at times.,card_payment_fee_charged
2616,I need to be made aware when I am being charged an extra amount for payments please. I looked over the app earlier and noticed an additional feel related to one of the payments. I was not warned about this before.,card_payment_fee_charged
2617,Why was I charged extra when paying with card?,card_payment_fee_charged
2618,Why am I charged a fee when using my debit or credit card?,card_payment_fee_charged
2619,"I am getting charged fees on some payments.  Please help me understand, where are these fees disclosed?",card_payment_fee_charged
2620,Why was the price higher when I paid with my card?,card_payment_fee_charged
2621,I just made an order and noticed an extra fee. Why have you charged me this without informing me?,card_payment_fee_charged
2622,I didn't know I was going to get charged to use my card.,card_payment_fee_charged
2623,I have been charged an extra fee when buying from your store. Why is this?,card_payment_fee_charged
2626,Let me know when applying extra charges for payments. I just checked the app and saw a fee that I wasn't warned about.,card_payment_fee_charged
2627,Why was I charged an additional fee when paying with card?,card_payment_fee_charged
2629,I paid with card and I was charged a fee,card_payment_fee_charged
2630,I made a purchase but never expected to see a fee charged for the transaction.,card_payment_fee_charged
2632,My card was charged more than expected.,card_payment_fee_charged
2633,Where can I check to see if there will be a fee added to my payment? Are there specific instances that will result in a fee added?,card_payment_fee_charged
2634,Why have i been charged a fee for using my card?,card_payment_fee_charged
2635,Why was I charged extra using my card?,card_payment_fee_charged
2636,How was I charged extra when I used my card to pay?,card_payment_fee_charged
2637,When do i get charged a fee for using the card?,card_payment_fee_charged
2639,Why was I charged a fee for my card payment?,card_payment_fee_charged
2640,Why was I charged an extra fee when using the card?,card_payment_fee_charged
2641,Let me know when you charge for payments. I just checked the app and saw a fee that I wasn't warned about.,card_payment_fee_charged
2642,What is the charge for paying with my card?,card_payment_fee_charged
2643,I paid with my card and ended up being charged a fee.,card_payment_fee_charged
2644,Why is there a fee on a card payment?,card_payment_fee_charged
2645,I was unaware of the additional charge that was added onto my previous payment. A notification of extra charges would be appreciated in the future.,card_payment_fee_charged
2646,I don't think I should have been charged a fee to use my card.,card_payment_fee_charged
2647,A fee that shouldn't be there is there after using my card!,card_payment_fee_charged
2648,"How do I see what fees I am supposed to be charged on my account? I've noticed fees on some transactions, but not on others. This is very confusing and I cannot find a pattern to what I am being charged?",card_payment_fee_charged
2649,Why am I getting charged more for using my card?,card_payment_fee_charged
2650,I see a fee that I think was charged because I paid by card.,card_payment_fee_charged
2651,What are the fees imposed when I make a transaction?,card_payment_fee_charged
2652,What was the extra charge for using my card?,card_payment_fee_charged
2653,Why was a fee added to my bill when I used my card?,card_payment_fee_charged
2654,Please tell my why I was charged a fee for using my card?,card_payment_fee_charged
2655,How can I check how much free spending I have left? I have some big purchases coming up and want to know where I can look for any info.,card_payment_fee_charged
2656,I was charged a fee when buying stuff with my card.,card_payment_fee_charged
2657,I was charged an additional amount of money for making a purchase with my card,card_payment_fee_charged
2658,What is the fee charged for using my card?,card_payment_fee_charged
2659,I just saw a fee on my account. When do these get charged?,card_payment_fee_charged
2660,Is it normal to get charged extra when i use my card?,card_payment_fee_charged
2661,This fee shouldn't be there after I paid with a card.,card_payment_fee_charged
2662,Why am I charged an extra fee on my card?,card_payment_fee_charged
2663,Why did I get charged more for using my card?,card_payment_fee_charged
2664,I recently bought an item using my card and I was charged an extra fee why is this?,card_payment_fee_charged
2665,I am angry that I got charged for using my card.,card_payment_fee_charged
2666,I wanted to know why i got an additional fee when i use my card.,card_payment_fee_charged
2667,"Is there a fee for making a payment? If so, let me know why.",card_payment_fee_charged
2668,Please tell me why I would have to pay a fee for a recent payment. Thanks.,card_payment_fee_charged
2669,Why was I charged a fee for debit or credit card payment?,card_payment_fee_charged
2670,Why was an extra charge added when I used my card?,card_payment_fee_charged
2671,Why have I been charged a small fee to use my card?,card_payment_fee_charged
2672,I was charged an extra fee for a card payment. I was unaware of these fees beforehand.,card_payment_fee_charged
2673,Why is there a fee associated with card use?,card_payment_fee_charged
2675,I got charged for with a fee for paying with my card.,card_payment_fee_charged
2676,Why am I being charged a fee on a card payment?,card_payment_fee_charged
2677,Is there a  way to  get around fees,card_payment_fee_charged
2678,I noticed an extra fee when I paid with my card.,card_payment_fee_charged
2679,You advertise no fee when paying with a card then my statement shows a fee.,card_payment_fee_charged
2680,"There was an extra fee when I paid with my card, why was i charged this extra fee?",card_payment_fee_charged
2682,what is this extra charge with my purchase?,card_payment_fee_charged
2683,Hello! I randomly got charged an extra fee today as i was shopping online and i have no idea why! Are there extra fees for card payments? Or am i missing something here?,card_payment_fee_charged
2685,When do you charge fees on accounts? I just saw a charge on my statement.,card_payment_fee_charged
2686,After I used my card I saw I was charged a fee for using it,card_payment_fee_charged
2688,Why am I being charged a hidden fee?,card_payment_fee_charged
2689,Can you explain why I was charged extra when I used the card?,card_payment_fee_charged
2690,Why did I get charged a fee on my card?,card_payment_fee_charged
2691,Do you have charges now when you pay with a card?,card_payment_fee_charged
2693,Why am I charged a fee for using my card on some purchases?,card_payment_fee_charged
2694,Why am I being charged a fee for using my card? If there is some print out of places that charge me can you please send me that?,card_payment_fee_charged
2695,How can I tell if there will be a fee added to my payment or not?,card_payment_fee_charged
2696,You promised no fees but now I've got one. What the hell!?,card_payment_fee_charged
2697,How do I know which payments I make will have additional fees? Where can I find this information online?,card_payment_fee_charged
2699,What is the time frame that it usually takes for a transfer to come through? I have a friend needing it immediately but it has yet to come through.,transfer_not_received_by_recipient
2700,My money transaction can't be seen by the person I sent it to,transfer_not_received_by_recipient
2701,"How long does it typically take a transfer to go through?  I sent some money to a friend earlier today, and she really needs it.  It still is a pending transfer, even though I sent it a few hours ago.",transfer_not_received_by_recipient
2702,"I have done a transfer within the country the day before yesterday, but it's still not there yet. Can you please check what's going on with that, the account number definitely is the right one, I've checked that already.",transfer_not_received_by_recipient
2703,"I have done a transfer within the country the day before yesterday, but it's still not there yet. Can you please check what's going on with that, the account number is the right one, I've checked that several times already.",transfer_not_received_by_recipient
2706,I do not know where the transaction is.,transfer_not_received_by_recipient
2707,I transferred money but the recipient does not see the funds in their account?,transfer_not_received_by_recipient
2708,why hasn't a transaction to a friend cleared yet?,transfer_not_received_by_recipient
2709,The app isn't showing my transactions,transfer_not_received_by_recipient
2710,Why isn't the recipient seeing the transaction? I just sent the money.,transfer_not_received_by_recipient
2712,Is there a reason why a recipient might not see my money transaction,transfer_not_received_by_recipient
2713,I don't see the transaction I made to a friend on my account.,transfer_not_received_by_recipient
2714,why has a transaction to a friend been delayed?,transfer_not_received_by_recipient
2715,"A transaction I did to my friend hasn't arrived yet, why?",transfer_not_received_by_recipient
2717,I am having an issue with an in country transfer I did a few days ago. It has yet to appear in my account. I have checked to be sure that all account information is correct multiple times. What is taking the transfer so long?,transfer_not_received_by_recipient
2719,How much time do transfers typically take? I sent money to a friend who needs it urgently. It's been hours and has not gone through.,transfer_not_received_by_recipient
2720,A transaction to a friend still hasn't shown up.,transfer_not_received_by_recipient
2721,I sent money and the recipient has not received their money after two weeks.,transfer_not_received_by_recipient
2723,Why did the funds not transfer to another recipient?,transfer_not_received_by_recipient
2725,I tried to transfer some money and it hasn't done it yet - what's going on?,transfer_not_received_by_recipient
2726,I made a transfer and they haven't received the money I sent them.,transfer_not_received_by_recipient
2727,"how long does it take to transfer money, my retailer is waiting",transfer_not_received_by_recipient
2728,"I sent money to someone but they haven't gotten it, what's going on?",transfer_not_received_by_recipient
2729,"How long does it take for transfers to process?  I sent funds to a friend, and she says that she has not yet received anything.",transfer_not_received_by_recipient
2731,I sent money about 5 days ago and the recipient has not received the money yet.,transfer_not_received_by_recipient
2732,I am just waiting on the completion of the transaction.,transfer_not_received_by_recipient
2733,My cash transaction isn't showing on my account,transfer_not_received_by_recipient
2735,When are you going to transfer the money?,transfer_not_received_by_recipient
2737,I need to check status as my friend hasn't got money I sent.,transfer_not_received_by_recipient
2738,How long do transfers typically take? Is there a way of speeding the process up? My friend needs the money I sent her desperately.,transfer_not_received_by_recipient
2739,wheres my money receipt,transfer_not_received_by_recipient
2740,Money is not in recipients account.,transfer_not_received_by_recipient
2741,How long does it take for money to transfer?  I sent some to a friend and it hasn't gone through yet.,transfer_not_received_by_recipient
2742,Why hasn't the transaction I did to my friend arrived yet?,transfer_not_received_by_recipient
2743,"How much time do transfers take? I sent money to a friend who needs it fast. It's been hours, and the money has not gone through.",transfer_not_received_by_recipient
2744,"How long should a transfer normally take to process completely? I have a friend that needs it right away, but it's already been 2 hours and she hasn't received it.",transfer_not_received_by_recipient
2745,My friend says he hasn't received my transaction,transfer_not_received_by_recipient
2746,What is the length of a transaction completion?,transfer_not_received_by_recipient
2748,I need to transfer some money to a friend who is in urgent need of some fast cash. How long will it take before she can use that money?,transfer_not_received_by_recipient
2749,Two days ago I did a transfer to another account within the country.  It doesn't appear the transfer went through.  I have verified the account number several times.  Could you please check on this for me?,transfer_not_received_by_recipient
2750,Where did the money transfer go?,transfer_not_received_by_recipient
2752,I transferred some money to my mom 2 days ago and she has not received it. I double checked the information and it looks right. Can you help me?,transfer_not_received_by_recipient
2755,I am just waiting for the transaction to be completed.,transfer_not_received_by_recipient
2756,How long do I have  to wait for my transaction to be completed?,transfer_not_received_by_recipient
2757,I did a money transaction and the recipient doesn't see it,transfer_not_received_by_recipient
2758,Why hasn't my friend received the money i sent them yet?,transfer_not_received_by_recipient
2759,I sent money for my rent to my landlord but she is claiming it hasn't arrived in her account  Can you trace the transfer I made to make sure it arrived so I can provide proof I sent it and that it has been deposited?,transfer_not_received_by_recipient
2760,Why didn't my friend's transaction arrive yet?,transfer_not_received_by_recipient
2763,What do I do if I completed a money transfer but the recipient hasn't received it?,transfer_not_received_by_recipient
2764,"I have done a transfer within the country a couple days ago, but it's still not there yet. Can you please check what's going on with that, the account number definitely is the right one, I've checked that several times already.",transfer_not_received_by_recipient
2765,I'm still waiting for my transaction.,transfer_not_received_by_recipient
2767,I set up a payment to a new payee and sent some money but the person I'm sending it to has not received it.  Can you check where the money is?,transfer_not_received_by_recipient
2768,My new landlord says he hasn't received the rent payment that I transferred a couple days ago. I've already checked the account numbers and they are correct. Can you tell me what's going on with this transaction that the transfer isn't showing up on my landlord's end?,transfer_not_received_by_recipient
2773,"I'm trying to make a payment to my new landlord. Even though the payment was sent a few days ago, it isn't clearing on their side. Can you verify that payment has been made?",transfer_not_received_by_recipient
2775,my friend has not got the money I sent last week.,transfer_not_received_by_recipient
2776,Why can't the person I sent the money transfer to see it?,transfer_not_received_by_recipient
2777,The money has not yet been placed in recipients account.,transfer_not_received_by_recipient
2778,I'm getting concerned here.  I sent a friend some money and she isn't seeing it.  What's going on?,transfer_not_received_by_recipient
2779,I completed I transfer the day before yesterday in this country. The transfer still is not complete. I've checked on the account number multiple times to make sure that it is the right one. Can you check to see what's going on with this?,transfer_not_received_by_recipient
2780,"I made a transfer for my rent payment about 2 days ago, but my landlord hasn't received it yet. It shows as done on my  side, and I've double check all account numbers and they are correct. Can you verify that the transaction was actually made?",transfer_not_received_by_recipient
2781,Why hasn't arrived yet a transaction I did to my friend?,transfer_not_received_by_recipient
2782,I'm waiting for my transaction to complete.,transfer_not_received_by_recipient
2783,Why hasn't my friend received the transaction?,transfer_not_received_by_recipient
2786,How long do money transfers take? My friend really needs the money i sent a couple of hours ago but it's not there yet.,transfer_not_received_by_recipient
2788,I have not received the completed transaction.,transfer_not_received_by_recipient
2791,"Hello, a few days ago I transferred my rent check to my landlord, however, he is saying that it has not gone though. On my end everything looks fine and I double checked the account number. Is there anything else that could be holding up the check?",transfer_not_received_by_recipient
2792,Why can't the recepient of my money transaction see it?,transfer_not_received_by_recipient
2793,The recipient doesn't see the money transaction I made,transfer_not_received_by_recipient
2796,"i accidentally entered in my retailers information, what should i do next",transfer_not_received_by_recipient
2799,I tried doing an in country transfer earlier this week. I thought it would be there by now but I still don't see the money. Can you check the status on my transfer?,transfer_not_received_by_recipient
2800,Is there a reason a payment is showing complete on my side but the person who is receiving it has not gotten it?,transfer_not_received_by_recipient
2801,I've checked multiple times to make sure the account number listed is the right one after attempting to make a transfer within the country the day before yesterday. The transfer is still not available so can you please find out what is going on?,transfer_not_received_by_recipient
2803,Why is my transaction taking so long to complete?,transfer_not_received_by_recipient
2805,I sent money to my family last Friday but they don't have it.,transfer_not_received_by_recipient
2806,When will I get my money? It's been too long.,transfer_not_received_by_recipient
2807,Why didn't my transfer get to the recipient?,transfer_not_received_by_recipient
2809,"I transferred a payment a couple days ago and it shows done, but it has not been received.  Could you please help me?",transfer_not_received_by_recipient
2810,I payed my rent to my landlord a few days ago and he is saying the it never went though. Everything looks good to me and I even double checked the account number. I don't know what could be causing the confusion. Can you help me please?,transfer_not_received_by_recipient
2811,My transaction has not been received. When are you going to process it?,transfer_not_received_by_recipient
2812,"Hi, I sent my landlord my rent money a few days ago and while everything seems good on my end he says that he never got the money. I double checked the account number and it's correct. Can you help me figure this out?",transfer_not_received_by_recipient
2813,My cash transaction isn't showing on my receipt,transfer_not_received_by_recipient
2815,I did a money transaction and dont have a receipt,transfer_not_received_by_recipient
2816,I have a friend who needs money as soon as possibly. If I were to transfer it how long will it take to get to her?,transfer_not_received_by_recipient
2817,Why hasn't my friend's transaction arrive yet?,transfer_not_received_by_recipient
2818,Hi - I have made a transaction to my new landlord but unfortunately it shows on my end but not on the landlord's end. The numbers are correct. Can you confirm when that will go through?,transfer_not_received_by_recipient
2819,I sent money to someone but they haven't gotten it yet,transfer_not_received_by_recipient
2821,My transfer didn't arrive to the recipient,transfer_not_received_by_recipient
2822,Recipient has not received the money,transfer_not_received_by_recipient
2823,The recipient can not locate funds.,transfer_not_received_by_recipient
2825,My new landlord is a lier and is trying to rip me off by saying I've not paid my rent when I have paid my rent.  What is going on?  They say the money hasn't got to them but I see it going out of my account.  Can you check that the money went to the right place?,transfer_not_received_by_recipient
2826,I made a transfer to my friend earlier and she hasn't received it yet.  What's the hold up?,transfer_not_received_by_recipient
2827,"|I moved out of my old house two weeks ago and cancelled my direct debit to my old landlord, this direct debit was working fine.  Now I've moved in to a new place and set up a transfer to a new landlord but it's not reached her yet, can you check it please?",transfer_not_received_by_recipient
2828,Why is the transaction to my friend still pending?,transfer_not_received_by_recipient
2829,"The day before yesterday, I performed a transfer within the country. It still has not completed. Can you check on that? The account number is definitely correct, as I've checked.",transfer_not_received_by_recipient
2830,"I have checked the account information several times to be sure that it is correct, but the in country transfer I did a few days ago still has not appeared! What is the hold up?",transfer_not_received_by_recipient
2831,"I performed a transfer within the country the day before yesterday, but it has not gone through? Can you check on that? The account number is definitely correct, as I've checked.",transfer_not_received_by_recipient
2832,The day before yesterday I transferred funds to another account within the country.  The funds have not yet arrived.  I double and triple checked the account number and it was correct.  Why hasn't the transfer been completed yet?,transfer_not_received_by_recipient
2834,"How long does it take for transfers to be approved?  I sent funds to my girlfriend, and she says that she has not seen any approved funds in her account.",transfer_not_received_by_recipient
2836,I'm still awaiting for the completion of the transaction.,transfer_not_received_by_recipient
2838,I dont see my reciept,transfer_not_received_by_recipient
2839,Why hasn't my transaction been completed?,transfer_not_received_by_recipient
2840,I sent some money and the account hasn't recived the transfer I made.,transfer_not_received_by_recipient
2841,I'm still expecting the transaction to be finished,transfer_not_received_by_recipient
2842,I transferred some money to a friend of mine who urgently needs some money right now. How long will it take to get to her?,transfer_not_received_by_recipient
2843,"I sent a payment, but the person I sent it to says they don't have it",transfer_not_received_by_recipient
2844,"I have done a transfer within the country the day before yesterday, but it's still not there yet. Can you please check what's going on with that, the account number definitely is the right one, I've checked that several times already.",transfer_not_received_by_recipient
2845,"I need to verify a payment to my new landlord. I transferred the first rent payment a few days ago. While it shows on my side, the landlord is saying he hasn't received it yet. Can you verify that it has processed?",transfer_not_received_by_recipient
2846,"I've been waiting since Friday, where is my money?",transfer_not_received_by_recipient
2847,I sent some money but the intended recipient says it hasn't arrived,transfer_not_received_by_recipient
2849,I just did a money transaction but its not showing they received it,transfer_not_received_by_recipient
2851,"I just transferred my friend money, but she hasn't received it yet, and it's been a few hours. Can you tell me when to expect it to go through?",transfer_not_received_by_recipient
2852,How long will my most recent transfer take to go through? The recipient needs the money urgently.,transfer_not_received_by_recipient
2853,My recipient hasn't received the money,transfer_not_received_by_recipient
2855,I just sent money but the person I sent it to doesn't see it. What happened?,transfer_not_received_by_recipient
2856,Why hasn't my transaction completed?,transfer_not_received_by_recipient
2857,Why hasn't the transaction I did arrive yet?,transfer_not_received_by_recipient
2858,Why isn't the transfer I made to a friend showing?,transfer_not_received_by_recipient
2859,Why is my friend not getting a transaction arrival yet?,transfer_not_received_by_recipient
2860,How long will a transaction to a friend take?,transfer_not_received_by_recipient
2861,Why hasn't my in country transfer gone through yet? I confirmed the account info a couple days ago but the payment hasn't been posted yet.,transfer_not_received_by_recipient
2862,"I completed a transfer within the UK two days ago, but it is still not showing received.  I have verified the account number is correct already.  Is there anything else I need to do or is there a problem?",transfer_not_received_by_recipient
2863,How can I the person see my money transaction?,transfer_not_received_by_recipient
2864,I sent a transfer to a friend that needs it urgently. It has already been 2 hours and still hasn't come through to her. How long does it normally take?,transfer_not_received_by_recipient
2867,"I sent some money to somebody a couple of hours ago, and they still have yet to receive it.  They really need the money, how much longer are they going to have to wait?",transfer_not_received_by_recipient
2869,How do I use American express to top up my account?,supported_cards_and_currencies
2870,Which currencies do you accept for adding money?,supported_cards_and_currencies
2873,Can I use my American Express card to add money into my account?,supported_cards_and_currencies
2875,I want to use my American Express for adding money into my account.,supported_cards_and_currencies
2876,With what currencies can I add money?,supported_cards_and_currencies
