id,text,category
7531,"The transfer keeps failing , I tried to transfer some money to friends this morning but it keeps getting rejected for some reason, Would you please check the issue?",failed_transfer
7533,Why wouldn't a transfer go through?,failed_transfer
7534,Can you please tell me why my transfer failed?,failed_transfer
7535,I did a transfer earlier but see that it failed to go through.,failed_transfer
7536,Why has my payment not transferred?,failed_transfer
7537,I tried to do a transfer but it didn't go through.,failed_transfer
7538,The attempted transfer failed.,failed_transfer
7539,I need help making this transfer. I keep getting an error. I'm trying to purchase a flat but i need my mortgage payment to go through first. Can you help?,failed_transfer
7540,Why does my transfer keep failing? I've tried 5 times and they all failed.,failed_transfer
7541,A mortgage payment I'm making is giving me an error message.  This is the first time I'm making this payment and want to know what's wrong.,failed_transfer
7542,"Hi, can you tell me why my transfer keeps being rejected? I've been trying to send money to my friends this morning but failed every time and I have no idea why?",failed_transfer
7543,I need assistance completing a transfer. I'm trying to purchase a flat and need the money for the initial mortgage payment. I keep getting an error and the transfer is not going through. What is going on here?,failed_transfer
7545,Why was I unable to complete my transfer?,failed_transfer
7546,"Hi, I'm buying my son Bertie a starter home in London.  I'm just trying to send the 5% deposit over to the agent. It's only £200,000 but seems to be throwing an error.  What is going on?  If I wait any longer the house prices might rise, can you look in to it please?",failed_transfer
7547,I'm trying to make a bank transfer but It's not going through. Could there not be enough funds to transfer or something? Have I done it too many times?,failed_transfer
7548,I need to know what is going on. I'm attempting to purchase a flat and need the money to pay on my initial mortgage payment. I'm only getting an error. Can you find out what's going on and help in making the transfer?,failed_transfer
7549,Can you please explain why my transfer failed?,failed_transfer
7550,I think youre system may be broken because I have tried transfer money 5x and it isnt working!  I'm not doing anything complicated it is what I usually do.,failed_transfer
7553,"I can't transfer any money from my account to my friend's account, it keeps rejecting it. Can you tell me why? I have enough funds in my account to transfer.",failed_transfer
7554,Why did the bank reject my transfer?,failed_transfer
7555,"I tried and tried, but I could not complete my transfer. Tell me what is wrong.",failed_transfer
7556,I'm getting an error when trying to make a payment. I want to purchase a flat but my mortgage payment needs to go through. Can you help me?,failed_transfer
7557,The transger I tried to make failed.,failed_transfer
7559,"I've tried to send money to my friends and I keep getting rejected. Can you please tell me why, I don't understand.",failed_transfer
7560,why do i have a failed transfer,failed_transfer
7561,I've tried completing a very standard transfer and have already attempted it 5 times. What's going on here? Is there a problem with your system?,failed_transfer
7562,"When I attempted to make a transfer, it failed.",failed_transfer
7563,Why can't my transfer complete?,failed_transfer
7564,Why can't I complete the transfer?,failed_transfer
7565,I want to transfer money. How do I do that for my account?,transfer_into_account
7566,How do I transfer money into my account?,transfer_into_account
7567,How can I link my bank to my top up account?,transfer_into_account
7569,HOW DO I TRANSFER MONEY FROM MY BANK ACCOUNT?,transfer_into_account
7570,Whats the transfer process,transfer_into_account
7571,How can you assist me on topping up on bank transfers to my account?,transfer_into_account
7572,Can I add money to my account via bank transfer?,transfer_into_account
7573,I want to op up my account by using bank transfer. How do I go about it?,transfer_into_account
7574,I have questions about how to transfer money to my account.,transfer_into_account
7575,I need to add money to my account. Can I do so via bank transfer?,transfer_into_account
7576,Can I use my bank account to send me more money?,transfer_into_account
7577,I can't figure out how to transfer money into my account.,transfer_into_account
7578,Can you please explain how to transfer money using the bank transfer process?,transfer_into_account
7579,How simple is it to transfer money into my account?,transfer_into_account
7580,How can my account have money transferred into it?,transfer_into_account
7581,"I am in desperate need to transfer funds from another account that i have into this one, how do i do that?",transfer_into_account
7582,How do I use bank transfer to top up my account?,transfer_into_account
7585,How can I move money from an account at another bank to this one?,transfer_into_account
7586,What process should I use to transfer money into my account?,transfer_into_account
7587,"I want to transfer money into my account, what do I do?",transfer_into_account
7588,I need to deposit money to my account,transfer_into_account
7589,Can you transfer money to your card by bank transfer?,transfer_into_account
7590,What do you do to transfer money to my account?,transfer_into_account
7591,How can I move money from my account at a different bank to the account I have at this bank.,transfer_into_account
7592,Please provide details on how to top up my account using transfer option,transfer_into_account
7593,Where can I find out how to transfer money into my account.,transfer_into_account
7594,How does it work when I transfer money into my account?,transfer_into_account
7595,I need assistance with transferring funds to another account.,transfer_into_account
7596,How can I add money to my account from another account I have?,transfer_into_account
7597,I have money in a foreign account that I want to send to this account.,transfer_into_account
7598,How can I transfer money into my account?,transfer_into_account
7599,I need to move money from another bank to this account.,transfer_into_account
7600,I need to transfer money into this account from my other bank account.,transfer_into_account
7601,How do I go forth with bank transfers for top up accounts?,transfer_into_account
7602,"I have an account at another bank, but I want to transfer some of the money to my account here.
.",transfer_into_account
7603,"I want to do a bank transfer to this bank, from an account at another bank.",transfer_into_account
7604,What are my bank details so I can do a transfer?,transfer_into_account
7605,How would I use a bank transfer for topping my account?,transfer_into_account
7606,I would like to know how to transfer money into my account.,transfer_into_account
7607,My account is devoid of funds. Am I permitted to submit additional money via bank transfer?,transfer_into_account
7608,How does a bank transfer for topping my account work?,transfer_into_account
7609,I'd like to know how transferring my money into my account works.,transfer_into_account
7610,How is my money transferred to the account,transfer_into_account
7611,How do I top up my account with a bank transfer?,transfer_into_account
7613,I would like to transfer money into my account.,transfer_into_account
7614,I would like to transfer money from my checking account to my savings account.,transfer_into_account
7615,I want to transfer money into my account,transfer_into_account
7616,What transfer methods do you accept?,transfer_into_account
7617,"I need to transfer money into my account, and I don't know how to do that.",transfer_into_account
7618,"I need to transfer money into my account, HOW?",transfer_into_account
7619,Can I transfer money to my card via bank-transfer?,transfer_into_account
7621,I need to know the process to transfer money into my account.,transfer_into_account
7622,Can I add money to top up my account via a bank transfer?,transfer_into_account
7624,How do I top up my account using transfer?,transfer_into_account
7625,Account topping up bank transfers to my account assistance please?,transfer_into_account
7626,I want to take some funds from my other bank account and add them to this one.,transfer_into_account
7627,I need more money in my account. Can I add more by transferring?,transfer_into_account
7628,How do I go about transferring money into my bank account?,transfer_into_account
7629,How do I go forth on transferring a sum of money from one account to another?,transfer_into_account
7630,How do I initiated a bank transfer to top up?,transfer_into_account
7631,How can I transfer money between accounts?,transfer_into_account
7632,Whats the process of tranfering money into an account?,transfer_into_account
7633,"I would like to top up my account with a bank transfer, is that allowed?",transfer_into_account
7635,I have zero dollars in my account. Can I submit additional funds via bank transfer?,transfer_into_account
7636,What are the steps for  making a transfer for topping up?,transfer_into_account
7637,"For my account, how do I transfer money in?",transfer_into_account
7638,How do I transfer money between two of my accounts?,transfer_into_account
7639,What is the procedure to transfer money to my account?,transfer_into_account
7640,Is a bank transfer acceptable for topping up my account?,transfer_into_account
7641,I have no more money in my account.  Is there a way to do a bank transfer to put money into my account?,transfer_into_account
7642,I need to transfer funds from my other bank account into this bank account.,transfer_into_account
7643,I want to transfer a sum of money from another bank account I have into this one,transfer_into_account
7644,Can I transfer money to my account with the app?,transfer_into_account
7645,Can you tell me how transferring money into my account works?,transfer_into_account
7646,Help! My account doesn't show any funds. Is transferring funds an option I can use?,transfer_into_account
7648,How can I top up my account by bank transfer?,transfer_into_account
7649,I was wondering about transferring money into my account and how it works.  Can you tell me about that?,transfer_into_account
7651,I need to move money from one of my other accounts to this one.,transfer_into_account
7652,What is the process for transferring money into my account?,transfer_into_account
7653,Tell me how to top up my account using bank transfer.,transfer_into_account
7654,Can I top-up my card using a bank transfer.,transfer_into_account
7655,Can I use a bank transfer to add money to my account?,transfer_into_account
7656,"I want to top up by transfering accounts, What do I do?",transfer_into_account
7657,show me how to transfer to my account,transfer_into_account
7658,How does your app transfer the money,transfer_into_account
7659,How do I deposit through bank transfer?,transfer_into_account
7660,My account is depleted. Can I transfer funds from another bank?,transfer_into_account
7662,What can I expect if I use bank transfer to top up my account?,transfer_into_account
7663,I want to transfer some money from my other bank account into this one.,transfer_into_account
7664,I want to transfer money from another account into this one.,transfer_into_account
7665,I would like to move money from one account to another to top off my account. Can you explain how I can do that?,transfer_into_account
7666,Can I withdraw money from another bank and transfer it into my empty account?,transfer_into_account
7667,How can I go about transferring money to my account?,transfer_into_account
7668,How can I transfer money to this account from another bank?,transfer_into_account
7669,can i transfer money i the app,transfer_into_account
7671,What steps are taken to transfer money into my account?,transfer_into_account
7672,I am out of money in my account and I was wondering if I could do a bank transfer is put more in it?,transfer_into_account
7673,Can you please explain how bank transfers work?,transfer_into_account
7674,Can you help me transfer funds from another bank account to this account?,transfer_into_account
7675,I am looking to transfer some money from my other bank account into this one.,transfer_into_account
7676,where do i go to transfer money from one account to this one,transfer_into_account
7677,I need money put into this account from another one.,transfer_into_account
7679,where is the code for verifying the top up card?,verify_top_up
7680,The top-up card is verified how?,verify_top_up
7681,Tell me about verifying top-up,verify_top_up
7682,What is the verification code for my top up card?,verify_top_up
7683,Explain to me how to verify the top-up card.,verify_top_up
7684,How can I verify my top-up card?,verify_top_up
7685,Can you show me how to verify the top-up card?,verify_top_up
7686,Can you explain to me the way to verify my top up has gone through?,verify_top_up
7687,I can't find the top-up card verification code.,verify_top_up
7688,I would like to receive instructions showing the verification process for top up cards..,verify_top_up
7689,Where is the top-up verification code located?,verify_top_up
7690,For what reason must I authenticate the top up?,verify_top_up
7691,what's my top-up verification code?,verify_top_up
7692,Why do the top-ups need to be verified?,verify_top_up
7693,Does the top-up need verified?,verify_top_up
7694,I am having trouble finding the top-up card verification code.,verify_top_up
7695,Why do you ask for top-up verification?,verify_top_up
7696,Where can I find the top up verification code?,verify_top_up
7697,How is top-up verified?,verify_top_up
7698,Do I need to verify my top-up card?,verify_top_up
7700,What is the point of verifying a top up?,verify_top_up
7701,How do I verify my top up?,verify_top_up
7702,How do I find the top-up verification code?,verify_top_up
7703,Why does top-up need to be verified?,verify_top_up
7704,why do i have to verify top up?,verify_top_up
7705,"I'm trying to verify my top-up card, but I can't find the code...?",verify_top_up
7706,How can I verify the top-up card?,verify_top_up
7707,how do I find the code to verify the top up card?,verify_top_up
7708,I need to find the top up verification code,verify_top_up
7709,Please help me find my top-up verification code,verify_top_up
7710,Where can I find the verification code for the card top-up?,verify_top_up
7711,Do I need to verify my top-up?,verify_top_up
7712,Why do we need to verify a top-up card?,verify_top_up
7713,I have a top up card. Where is the verification code?,verify_top_up
7715,How do i find my top-up card's verification code?,verify_top_up
7716,How do I verify the top-up?,verify_top_up
7717,How many digits identify the top-up verification code?,verify_top_up
7718,What is the significance of verifying the top-up?,verify_top_up
7719,Why do we need to verify top-up?,verify_top_up
7721,Is there a reason why top-up needs verifying?,verify_top_up
7722,I don't know where the top-up verification code is.,verify_top_up
7723,Verifying the top-up seems like a hassle.,verify_top_up
7724,I can't see a verification code anywhere,verify_top_up
7725,Verify top-up card help?,verify_top_up
7726,What do I do to verify a top-up?,verify_top_up
7727,Is there a way to verify a card top-up?,verify_top_up
7728,How to verify top up card?,verify_top_up
7729,Why are top-ups being verified?,verify_top_up
7730,why verify the top up? it doesnt make sense,verify_top_up
7731,The top-up verification code is not visible.,verify_top_up
7732,"I just tried to top-up and now I'm getting an additional verification message, why?",verify_top_up
7733,Where do I find my code to verify my top-up card?,verify_top_up
7734,Why verify the top-ups?,verify_top_up
7735,can you tell me where to find the top-up verification code?,verify_top_up
7736,How do I verify the top-up card?,verify_top_up
7737,Help me verify the card used on a top-up.,verify_top_up
7738,"On a card top-up, where can I verify?",verify_top_up
7739,"I'm trying to verify my top up card, how do I do that?",verify_top_up
7740,What is the verification process used for?,verify_top_up
7741,Where is my top-up verification code?,verify_top_up
7742,Where can i find my top-up verification code?,verify_top_up
7743,Where is the top-up verification code?,verify_top_up
7744,I don't see a code anywhere on my top-up card? Where can I find it? I need to verify!,verify_top_up
7745,Why do i have to verify my top-up card?,verify_top_up
7746,Do I have to verify the top-up?,verify_top_up
7747,Why do I need to verify the top-up?,verify_top_up
7749,I can't see a top-up top-up verification code.,verify_top_up
7750,I don't see the verification code for my card transfer.,verify_top_up
7751,Why does top-up require verification?,verify_top_up
7752,is there a reason i need to verify top up,verify_top_up
7753,Is the verification number on the top up card,verify_top_up
7754,What  is the verification process for a top up card?,verify_top_up
7755,Where is the top-up card verification code?,verify_top_up
7756,How do I verify the top up?,verify_top_up
7757,I am looking for my top-up verification code and cannot find it.,verify_top_up
7758,How do i authenticate a top-up card?,verify_top_up
7759,Do I need to verify the top-up?,verify_top_up
7760,What's the deal with verifying the top-up?,verify_top_up
7762,Where Is the top up verification code found?,verify_top_up
7763,Please tell me how to verify my top up card.,verify_top_up
7764,How do i secure a top-up card?,verify_top_up
7765,What's up with verifying top-ups?,verify_top_up
7766,Why do I need to verify a top-up?,verify_top_up
7767,Can I verify my top-up card?,verify_top_up
7768,Why is it necessary to verify the top up?,verify_top_up
7769,Why should I verify the top-up?,verify_top_up
7770,this verifying the top up is annoying,verify_top_up
7771,Why do we need to verify top-ups?,verify_top_up
7772,How are top-ups verified?,verify_top_up
7773,Tell me how I can verify a card top-up.,verify_top_up
7774,Do i need to verify my top up?,verify_top_up
7775,My top up card needs verification and I don't know how to do it,verify_top_up
7776,Where's my top up code?,verify_top_up
7778,Where can I find the verification code for a top-up?,verify_top_up
7779,Where do i verify a top-up card?,verify_top_up
7781,why do you verify the top up,verify_top_up
7782,Tell me why I need top-up to be verified?,verify_top_up
7783,"I just want to top-up, why do I need to verify anything?",verify_top_up
7784,Verifying top-up cards necessary?,verify_top_up
7785,Where is the top-up verification code sent?,verify_top_up
7786,What's a verification code?,verify_top_up
7787,Tell me how to verify a top up.,verify_top_up
7788,Where is the verification code display?,verify_top_up
7790,Why is top-up verified?,verify_top_up
7791,Why do I need top-up to be verified?,verify_top_up
7792,How do I authenticate my top-up?,verify_top_up
7793,What is the verification process for my card?,verify_top_up
7794,i don't see the top-up verification code anywhere,verify_top_up
7795,I'm being asked for a verification code. Where do I find it?,verify_top_up
7796,Why does a top- up need to be verify?,verify_top_up
7797,Help my find the verification code on a top-up.,verify_top_up
7798,How can I verify my top up?,verify_top_up
7800,What does top-up verification do?,verify_top_up
7801,I CAN NOT FIND THE TOP-UP VERIFICATION CODE.,verify_top_up
7802,How do I go about verifying the top-up card?,verify_top_up
7803,why do i need to verify the top up?,verify_top_up
7804,Are extra charges added for sending out additional cards?,getting_spare_card
7805,I'd like to order an additional card,getting_spare_card
7806,I want some extra physical cards.,getting_spare_card
7807,"I would like open a second card for my daughter, how can you assist me?",getting_spare_card
7809,Would I have to pay anything if I need an additional card?,getting_spare_card
7810,Is it possible to get a second card for my daughter?,getting_spare_card
7811,Can I get a few more physical cards?,getting_spare_card
7812,What's the limit on total number of cards I can have?,getting_spare_card
7813,Is there a charge for sending out more cards?,getting_spare_card
7814,How much does it cost to get more cards?,getting_spare_card
7815,How can I create another card linked to this account?,getting_spare_card
7819,Can I have more physical cards?,getting_spare_card
7820,How many physical cards am I allowed to have?,getting_spare_card
7821,I want to get few more physical cards,getting_spare_card
7822,Please tell me if I'm going to be charged for sending out more cards?,getting_spare_card
7823,Can I get more cards just incase?,getting_spare_card
7824,Would I be able to get a second card?,getting_spare_card
7825,Do you charge for sending out more cards?,getting_spare_card
7826,I need a second card on this account for my daughter.,getting_spare_card
7828,Can I have a third card?,getting_spare_card
7829,I have left my card at my parents house. Can you send me a spare one please to use in the meantime?,getting_spare_card
7830,I'd like to provide my daughter with a card - could I get an additional card from my account to give her?,getting_spare_card
7831,What is the price for an additional card?,getting_spare_card
7832,Can I get a second card for free?,getting_spare_card
7833,Will I be charged if I add more cards to the account?,getting_spare_card
7834,How many cards am I allowed?,getting_spare_card
7835,"Can my daughter also have a card issued in her name, but linked to my account?",getting_spare_card
7836,I'd like to order another card,getting_spare_card
7837,Can I have a supplementary card?,getting_spare_card
7839,My daughter need a card from this account. Is that possible?,getting_spare_card
7840,My daughter would like a card from my account?  Can I do this?,getting_spare_card
7841,Are there any fees to get additional cards?,getting_spare_card
7842,Can you send me more cards for my account?,getting_spare_card
7843,"I would like some more physical cards, what is my limit?",getting_spare_card
7844,Can I have a duplicate second card?,getting_spare_card
7845,"I want to give a second card for this account to my daughter, would this be possible?",getting_spare_card
7846,What is the procedure for me to get more cards on my account?,getting_spare_card
7847,Am I permitted to have a spare card?,getting_spare_card
7848,I was wondering if I could get a second card on this account? I would like my daughter to have one.,getting_spare_card
7849,Do I have to pay for a second card?,getting_spare_card
7850,I would like to purchase another card.,getting_spare_card
7852,I'd like to have extra cards. Will I have to pay for that?,getting_spare_card
7853,How do I get a spare card?,getting_spare_card
7854,How do i request more physical cards?,getting_spare_card
7856,I would like more physical cards,getting_spare_card
7857,Is there a charge for getting more cards?,getting_spare_card
7858,Can I have a second card issued to another family member?,getting_spare_card
7860,How much is it to buy another card? I was hoping to buy another one.,getting_spare_card
7862,How much would an extra card cost?,getting_spare_card
7863,I would like an extra card.,getting_spare_card
7864,Do you send duplicate cards?,getting_spare_card
7865,I would like to use one of my cards for a family member. Is that allowed?,getting_spare_card
7866,Can another family member hold a card for this account in addition to mine?,getting_spare_card
7867,I need another card,getting_spare_card
7868,"If I need an additional card, is there a fee for that?",getting_spare_card
7870,Will I get charged for sending out more cards?,getting_spare_card
7871,How many different cards can I have for my account?,getting_spare_card
7872,I need more physical cards.,getting_spare_card
7873,Am I allowed to carry an additional card?,getting_spare_card
7875,How do I get extra physical cards?,getting_spare_card
7876,Can I get spare cards?,getting_spare_card
7878,I need more physical cards than I have right now!,getting_spare_card
7879,Is a new debit card free?,getting_spare_card
7880,How many cards can I have?,getting_spare_card
7882,Do you charge extra for duplicate cards?,getting_spare_card
7883,I would like to get additional physical cards at this time,getting_spare_card
7884,How do I receive more physical cards,getting_spare_card
7885,"If I want to be able to give my daughter a card for my account, would I be allowed to get one for her?",getting_spare_card
7887,"I am interested in giving a second card to my daughter, how can I make this happen?",getting_spare_card
7888,Is it possible for me to give my daughter a second card for this account?,getting_spare_card
7889,"daughter needs card, how do i add her",getting_spare_card
7890,Is there any way to get another card on the same account?,getting_spare_card
7891,If I need more than cards will I have to pay a fee to receive them?,getting_spare_card
7893,I'd like to get another card,getting_spare_card
7894,"If I get another card, what kind of fees am I looking at?",getting_spare_card
7895,Will there be a charge for sending out more cards?,getting_spare_card
7896,I would like to get a few more physical cards.,getting_spare_card
7897,How many active cards can I have?,getting_spare_card
7898,How much does it cost for additional cards?,getting_spare_card
7899,What should I do if I want to get another card for someone in my family?,getting_spare_card
7901,I'm looking to get an additional card.,getting_spare_card
7903,I would like to get some extra cards?,getting_spare_card
7904,Is it free to send out more cards?,getting_spare_card
7905,Is it possible to purchase more physical cards with my account?,getting_spare_card
7907,How much is it to send out additional cards?,getting_spare_card
7908,Will it cost me to get a second card?,getting_spare_card
