id,text,category
4967,A withdraw I tried to make at the ATM was declined I don't know why.,declined_cash_withdrawal
4968,Tried using my ATM card earlier at one of your locations for the first time.  It didn't work.  What is going on?,declined_cash_withdrawal
4969,Why can't I take money from my account?,declined_cash_withdrawal
4970,"This morning I wanted to make a withdrawal before work, but my card was declined! Please double check it for me as this is the first time it was declined.",declined_cash_withdrawal
4971,Why was I declined from getting cash?,declined_cash_withdrawal
4972,"I tried to get money out of the Notting Hill ATM earlier, but wasn't able to. Is my card working okay? It's the first time I tried using it.",declined_cash_withdrawal
4973,My ATM card isn't working for a withdrawl,declined_cash_withdrawal
4974,Is my card actually working? It's the first time I tried using it,declined_cash_withdrawal
4975,Is there a reason why my card was declined when I attempted to withdraw money?,declined_cash_withdrawal
4976,Is the ATM broken? I can't get cash from it.,declined_cash_withdrawal
4977,what is my monthly spending limit because i was refused my money at an atm,declined_cash_withdrawal
4978,I can't get cash from the ATM!,declined_cash_withdrawal
4979,"When I tried to access my cash, I wasn't allowed!",declined_cash_withdrawal
4980,"My card has been declined by two separate ATM, and I'm worried something is wrong with my account. Would you please see if my account is okay?",declined_cash_withdrawal
4981,Has my account been frozen?  I tried to use my card but the ATM would not dispense cash.,declined_cash_withdrawal
4982,I tried to withdraw cash from the ATM machine and it did not work. Can you tell me why?,declined_cash_withdrawal
4983,ATM withdrawal not working.,declined_cash_withdrawal
4984,I tried using my ATM card at your Notting Hill location today.  It did not work.  Am I doing something wrong?,declined_cash_withdrawal
4985,"I tried to get money out of an ATM in Notting Hill earlier, but it didn't work. Is my card actually working? It's the first time I tried using it",declined_cash_withdrawal
4986,I cannot withdraw money from the ATM,declined_cash_withdrawal
4987,My withdrawal from the ATM was cancelled.,declined_cash_withdrawal
4988,I'm trying to take money from my account but its not letting me. Help!,declined_cash_withdrawal
4989,Why won't the ATM let me withdraw money?,declined_cash_withdrawal
4990,My cash withdrawal was declined.  Why?,declined_cash_withdrawal
4991,Why couldn't I get cash from an ATM?,declined_cash_withdrawal
4992,I attempted to get cash in the ATM but it was not authorized,declined_cash_withdrawal
4993,Is there something wrong with my ATM Card?  Tried using it earlier and it did not work.,declined_cash_withdrawal
4994,The ATM keeps rejecting my Payment. I tried two different ATMs but did not work .Can you please check if everything is okay with my account?,declined_cash_withdrawal
4995,Why can't I withdraw cash from this ATM?,declined_cash_withdrawal
4996,I was getting some cash out of the ATM but it cancelled on me without warning.,declined_cash_withdrawal
4997,I wasn't able to withdraw money at an ATM,declined_cash_withdrawal
4998,Why can't I withdraw funds from my account?,declined_cash_withdrawal
4999,I tried to get cash in the ATM but it was not approved,declined_cash_withdrawal
5000,My card rejected a cash withdrawal. Why?,declined_cash_withdrawal
5001,Why was my cash withdrawal declined by the ATM?,declined_cash_withdrawal
5002,I could not get the ATM to work,declined_cash_withdrawal
5003,totally unacceptable.  I'm stranded with no cash because the ATM wouldn't give me any money!,declined_cash_withdrawal
5004,Help! My card isn't working at the ATM and I know I used the right PIN. Trying to get my money.,declined_cash_withdrawal
5005,I tried to pull cash from an ATM but it wouldn't let me.,declined_cash_withdrawal
5006,"I tried to get money out of the Notting Hill ATM earlier, but I wasn't able to get it to work. Is my card with issue? It's the first time I tried using it.",declined_cash_withdrawal
5007,Can you please tell me why I cant get money from the ATM?,declined_cash_withdrawal
5008,"How do I get money from an ATM using my card? I can't seem to get it to work? I used the pin I had, but maybe it's wrong? What do I need to do to fix this?",declined_cash_withdrawal
5009,"Hello, is there any way to double check my card? I have never had issues with withdraws in the past, but this morning on the way to work it was unexpectedly declined.",declined_cash_withdrawal
5010,My card didn't work at the ATM in Notting Hill.  Is my card working?,declined_cash_withdrawal
5013,I cant get money out of the ATM with my card.  I just put my card in the ATM but it will not allow me to take any money out.  What do I need to do to fix this?,declined_cash_withdrawal
5014,Why was I not able to take cash from the ATM?,declined_cash_withdrawal
5015,"Would you please check my Card. As Withdrawal was working fine so far, but this morning suddenly got declined. Can you please check the problem?",declined_cash_withdrawal
5016,Why would the ATM machine fail to give me the cash withdrawal I requested?,declined_cash_withdrawal
5017,I am having trouble withdrawing cash.,declined_cash_withdrawal
5018,Why is the ATM not allowing me to get cash?,declined_cash_withdrawal
5020,I tried to get cash but it was declined!,declined_cash_withdrawal
5021,"Hi, I am unable to use my card in ATM. I had tried my card in two ATMs but both ATMs declined it. Could you please check my account?",declined_cash_withdrawal
5022,The ATM won't let me take out cash,declined_cash_withdrawal
5023,I'm not able to withdraw money from the ATM but I'm not sure why.,declined_cash_withdrawal
5024,why wouldnt the atm give me money,declined_cash_withdrawal
5025,"My cash withdrawal was declined, why?",declined_cash_withdrawal
5026,"I think there may be something wrong with my card. I have never had issues with withdraws before, but this morning on the way to work it was suddenly declined.",declined_cash_withdrawal
5027,Why can I not get cash from the ATM?,declined_cash_withdrawal
5028,Why was I not able to get cash from the ATM?,declined_cash_withdrawal
5030,Why am I not able to withdraw cash from this ATM?,declined_cash_withdrawal
5031,Why can't I withdraw money?,declined_cash_withdrawal
5032,The atm wouldn't give out cash,declined_cash_withdrawal
5033,What caused my cash withdrawal to be declined?,declined_cash_withdrawal
5034,Why wont the ATM give me cash?,declined_cash_withdrawal
5035,Why do I get declined when I try to withdraw cash?,declined_cash_withdrawal
5037,The ATM cancelled a transaction on me when I was trying to get some cash out.,declined_cash_withdrawal
5038,Why can't I get cash from the ATM?,declined_cash_withdrawal
5039,atm refused to give me money,declined_cash_withdrawal
5040,I was declined when I tried to withdraw cash!,declined_cash_withdrawal
5041,I couldn't get money from the ATM,declined_cash_withdrawal
5042,I tried to use the ATM today but it would not accept my card.,declined_cash_withdrawal
5043,The ATM wouldn't let me withdraw cash.,declined_cash_withdrawal
5044,"I tried to get money out of the Notting Hill ATM earlier, but I wasn't able to get anything out. Is there a problem with my card? It's the first time I tried using it.",declined_cash_withdrawal
5045,Please help me with my card. As i have tried to use my card in two different ATMs but repeatedly it was declining by ATM.,declined_cash_withdrawal
5046,The ATM wouldn't allow me to withdraw money,declined_cash_withdrawal
5047,Why am I unable to withdraw my money through this card?,declined_cash_withdrawal
5048,Is there a problem with my account? When I tried to withdraw cash at an ATM I was denied.,declined_cash_withdrawal
5049,ATM apparently not working?  Couldn't access funds in my account?,declined_cash_withdrawal
5050,Why is my card being declined at the ATM? I have tried multiple ATMs and i keep running into the same problem. Could you verify that everything is okay with my account?,declined_cash_withdrawal
5051,The ATM wouldn't let me have my money.,declined_cash_withdrawal
5052,I tired to get cash in the ATM but it was cancelled,declined_cash_withdrawal
5053,Is there something wrong with the ATM? It would not let me pull cash out of my account.,declined_cash_withdrawal
5054,"Hi, In morning, i was trying to withdraw money from my card, but it got declined. So far it was working fine. Could you please check my card.",declined_cash_withdrawal
5055,When going to the ATM to take out some cash today my withdrawal was  declined.  I need to fix this problem as soon as possible. whats going on?,declined_cash_withdrawal
5056,I can't get any money from my account.,declined_cash_withdrawal
5057,"I tried to withdraw cash, but got declined!",declined_cash_withdrawal
5058,"The ATM will not let me get cash, WHY?",declined_cash_withdrawal
5059,I can't withdraw any money from my account. Ive tried a couple different ATM machines and both of them wouldn't give me my money. What's going on? Is my account frozen or something?,declined_cash_withdrawal
5060,Why was my atm withdrawl declined,declined_cash_withdrawal
5061,why would i be declined if i had money iin my account,declined_cash_withdrawal
5062,Why was my cash withdrawal cancelled at the ATM?,declined_cash_withdrawal
5063,Why can't I withdraw cash?,declined_cash_withdrawal
5064,Why am I unable to withdrawal cash?,declined_cash_withdrawal
5065,I just had my card get declined at the ATM! I need to get money out but I am unable to.  Why has this happened?,declined_cash_withdrawal
5066,I entered the correct pin but I still couldnt get funds.,declined_cash_withdrawal
5067,My card wont work at an ATM,declined_cash_withdrawal
5069,i entered my pin in wrong and got it frozen. how many tries do i have,declined_cash_withdrawal
5070,This is the first time I've tried to get my money out of an ATM and it didn't work. Please give me my money,declined_cash_withdrawal
5071,Why am I having trouble withdrawing cash?,declined_cash_withdrawal
5072,"I tried to make a withdrawal from the ATM, but it was cancelled.",declined_cash_withdrawal
5073,I could not get money from an ATM,declined_cash_withdrawal
5074,I think I am having an issue with withdraws on my card. It was declined on the way to work this morning. This hasn't happened in the past.,declined_cash_withdrawal
5075,I attempted to get money in cash but it was refused!,declined_cash_withdrawal
5076,My ATM withdrawal was cancelled,declined_cash_withdrawal
5078,"Please check my Card. As Withdrawal was working fine so far, but this morning suddenly got declined. Can you please check the problem?",declined_cash_withdrawal
5079,"I tried to withdraw some funds from my card, but was declined. How can I get my money?",declined_cash_withdrawal
5080,I can't get the ATM to give me any cash,declined_cash_withdrawal
5081,I am unable to get cash from the ATM,declined_cash_withdrawal
5082,How come the ATM won't give me my money?,declined_cash_withdrawal
5083,I tried to withdraw cash from your ATM but my transaction was cancelled.,declined_cash_withdrawal
5084,Why did the ATM cancel my transaction,declined_cash_withdrawal
5085,Why wouldn't the ATM give me cash?,declined_cash_withdrawal
5086,Why wouldn't my withdrawal go through?,declined_cash_withdrawal
5087,I attempted to get cash in the ATM but I was denied,declined_cash_withdrawal
5088,The ATM didnt let me get cash,declined_cash_withdrawal
5089,Why am I unable to withdraw money even though in the past I've done it just fine?,declined_cash_withdrawal
5090,I was declined when I tried to take out cash!,declined_cash_withdrawal
5092,What does it mean when a payment is pending?,pending_card_payment
5093,Could you please tell me why my purchases from this morning say payment is pending?,pending_card_payment
5096,There is a payment that I made that hasn't gone through yet.,pending_card_payment
5097,How long does it actually take for a card payment to go through? There's one stuck since a couple days already that doesn't seem to move,pending_card_payment
5099,How long does a payment usually show as pending? Is it normal that mine is still pending?,pending_card_payment
5101,I have a card payment which shows as pending,pending_card_payment
5103,Why is the payment showing as pending from things I bought this morning?,pending_card_payment
5104,I made a card payment which is showing me pending.,pending_card_payment
5105,Why are my payments not working and show pending?,pending_card_payment
5106,"I put in a payment a while ago and it has still not cleared and is showing up as ""pending"", how long does it take to clear?",pending_card_payment
5107,Why are the things I bought earlier today still showing as pending?,pending_card_payment
5108,Card payment still pending.,pending_card_payment
5109,"My card payment is just showing up as pending since forever, what's going on with that, it should be going through at some point?",pending_card_payment
5110,I have a payment that has not gone through yet,pending_card_payment
5111,"I initiated a payment a while ago and it is still showing as ""pending"", how long will it take to clear?",pending_card_payment
5112,Why is my purchase showing as pending?,pending_card_payment
5114,After making a payment with my card it doesn't seem to have worked. It's just showing to be pending. When will this actually be going through?,pending_card_payment
5115,"It says ""pending payment?"" Why is it saying this?",pending_card_payment
5116,Is there a reason my payments are pending?,pending_card_payment
5117,Why is my card payment still a pending transaction?,pending_card_payment
5119,I have been waiting for my card payment to be moved from pending status for an unusually long time.  What is going on here and do you have an idea of when I can expect it to go through?,pending_card_payment
5121,I notice there's a pending payment on my card.,pending_card_payment
5122,How is my card payment still pending?,pending_card_payment
5123,Why is my card payment still pending?,pending_card_payment
5124,What does pending payment mean?,pending_card_payment
5126,What does it mean when it says that I have a payment that is pending?,pending_card_payment
5127,My card payment is showing pending however this transaction was a couple of days ago. Is there a reason why it it still pending?,pending_card_payment
5128,A card payment on my account is shown as pending.,pending_card_payment
5129,Why is their a charge pending on my card still?,pending_card_payment
5130,My card payment says pending and it hasn't changed,pending_card_payment
5131,Card payment is showing as pending,pending_card_payment
5132,What is the longest that a payment will show pending?  There is one showing that has been sitting there a few days.,pending_card_payment
5135,What's taking so long for this payment to go through?,pending_card_payment
5136,Why haven't I gotten my payment yet?,pending_card_payment
5137,It looks like a payment I've made hasn't made it through yet.,pending_card_payment
5138,My card payment has had the status of pending forever. What is the issue? It should have gone through at some point.,pending_card_payment
5139,A payment is pending,pending_card_payment
5140,Why hasn't my card payment cleared yet?,pending_card_payment
5141,I've made a card payment a couple of days ago now but it looks like the money is stuck. How long does it typically take for the payment to go through?,pending_card_payment
5142,My payment is taking a long time to go through.,pending_card_payment
5143,What does it mean if my payment is pending?,pending_card_payment
5144,When will my payment go through?,pending_card_payment
5145,My card payment still pending,pending_card_payment
5146,How long does a payment show as pending before i should worry about it?,pending_card_payment
5147,Why is my card payment pending?,pending_card_payment
5148,I made a card payment by my card but it failed. Please let me know when the payment will get completed as its still pending.,pending_card_payment
5149,"Hi, status of one of my card payment is still pending from a while. Please let e know how much time it will take to complete.",pending_card_payment
5150,"After I make a payment, how long will it be before it transitions from ""pending"" to complete?",pending_card_payment
5151,"My card payment is showing up as pending for a very long time, what's going on with that, it should be going through at some point?",pending_card_payment
5152,My purchases from this morning are showing up as payment pending. Can you tell me why?,pending_card_payment
5153,There is a payment that has not processed.,pending_card_payment
5154,I'm still waiting on a payment,pending_card_payment
5155,I need to find out why my pending payment hasn't gone through.,pending_card_payment
5156,I am waiting for a payment to be processed,pending_card_payment
5157,I don't understand why my card payment is pending.  It has been pending for too long.  Why is this and when might it go through?,pending_card_payment
5158,"I did a payment with my card but seem that didn't work, it's still listed as pending since a while ago. When does this actually go through?",pending_card_payment
5159,I need to know when a payment will actually go through. I completed a payment using my card but it is just showing as pending at this point and it has been a while ago.,pending_card_payment
5161,My card payment has been stuck on pending. What is the problem? It should have gone through by now.,pending_card_payment
5162,Why is the purchase I made this morning still pending?,pending_card_payment
5166,"I made a payment a while ago and it is still showing as ""pending"" in the account. How long will this payment take to complete?",pending_card_payment
5167,What does a 'pending payment' mean?,pending_card_payment
5168,"Hello, I made a payment with my card and it's not working. It's been a while and still says its pending. Can you tell when this will go through?",pending_card_payment
5169,"Hi,  One of payment is still coming as pending for which i have already paid by card. I guess it did not processed, could you please check and update me.",pending_card_payment
5170,My purchase from this morning still is pending.,pending_card_payment
5171,Why is my card payment still listed as pending?,pending_card_payment
5172,One of my card payments looks like it's stuck but I have made the payment days ago. How long until the payment will be applied to my account?,pending_card_payment
5173,I don't know what pending transaction means.,pending_card_payment
5177,I noticed that there's a payment on my card that's pending.,pending_card_payment
5178,When is a payment I made with my card going to clear>,pending_card_payment
5179,My card payment has been pending for a long time now. Why is it taking so long to take. It should have already made it through.,pending_card_payment
5180,What does it mean if it says that my payment is pending?,pending_card_payment
5181,Why are my purchases from this morning still pending?,pending_card_payment
5182,"I was wondering why my payment hasn't gone through yet, its been a while.",pending_card_payment
5183,My card payment has been on pending forever. What is the problem? It should have gone through at some time by now.,pending_card_payment
5184,I did a card payment but its status is still coming as pending. Please check and inform when it would complete.,pending_card_payment
5185,I have made a card payment but it did not completed still showing as pending. Please tell me when it will be completed.,pending_card_payment
5187,Why is my card payment still pending? It should have gone through already.,pending_card_payment
5188,"I made a purchase this morning, and it is showing as pending.",pending_card_payment
5189,There is a single payment on my card which shows as pending.,pending_card_payment
5191,How long does it take for my payment to process?,pending_card_payment
5192,Why would my payment for my card show as pending?,pending_card_payment
5193,Why aren't my payment funds available to me?,pending_card_payment
5194,I got some items this morning but the payment says pending,pending_card_payment
5196,Is there a problem that makes my payments show pending?,pending_card_payment
5197,I made a purchase earlier today but it is still listed as pending- when will it go through?,pending_card_payment
5199,I have a payment that hasn't went through yet.,pending_card_payment
5201,How long does it take for a new purchase to stop being considered pending?,pending_card_payment
5202,I was wondering how long does it take for a payment to go thru? It seems my last payment is stuck and hasn't moved.,pending_card_payment
5203,What is the cause of the delay in applying my card payment to my account?,pending_card_payment
5204,Why would my payment still show as pending?,pending_card_payment
5205,I have a payment which has not been approved.,pending_card_payment
5206,What does it mean when it says I have a payment pending?,pending_card_payment
5207,"There is a pending payment on my account, what does this mean?",pending_card_payment
5208,Why has my card payment not yet been applied to my account?,pending_card_payment
5209,I bought some things in the morning but the payment shows as pending,pending_card_payment
5210,I don't know what a pending payment is.,pending_card_payment
5212,How long does it actually take for a card payment to go through? There's one stuck since a couple of days already that doesn't seem to move,pending_card_payment
5213,I purchases several items today. Why are they still showing pending?,pending_card_payment
5214,There is a payment showing as pending and hasn't posted for a few days.  When will it post?,pending_card_payment
5215,"I have made a payment by my card, and its still pending since a long time. Could you please tell me when it will process.",pending_card_payment
5216,I completed a payment with my card a while ago. It's still showing up as pending. What time frame does this normally take? It doesn't appear to have worked.,pending_card_payment
5217,The payment on my card shows as pending.,pending_card_payment
5218,I have a payment that is still pending,pending_card_payment
5219,I bought something this morning and the payment is still pending,pending_card_payment
5221,I made a payment that's pending. Will it go through?,pending_card_payment
5222,It's been a few days since I've tried to pay a seller but the funds aren't going through. What is happening?,pending_card_payment
5223,I made a payment that seems to be stuck. It's been a couple of days already. Can you tell me how long it will take?,pending_card_payment
5224,I made a payment that is not yet complete.,pending_card_payment
5226,What is the meaning of a pending payment?,pending_card_payment
5228,How many days does a regular transaction take to complete?  I see a pending payment that hasn't changed in the last several days.,pending_card_payment
5230,My payment's stuck on pending.,pending_card_payment
5232,What's the pending length for credit transactions? I've had one in my pending category now for days and it won't move to processed.,pending_card_payment
5233,How long does it take for a payment to change from pending?,pending_card_payment
5234,My credit card payment has been in pending status for a super long time.  I don't get it.  Why is it like this?  When will it go through?,pending_card_payment
5238,What is the pending payment on my card about?,pending_card_payment
5239,"It says that my payment is pending, what does that mean?",pending_card_payment
5240,I tried to make a payment with my card and it was declined. Why is it pending?,pending_card_payment
5241,Why is it saying I have a pending payment?,pending_card_payment
5242,"Is there something wrong with my card payment? It's been pending a really, really long time.",pending_card_payment
5243,My purchases from this morning still have pending payments.,pending_card_payment
5244,When will my pending payment finish?,pending_card_payment
5245,"I used my card to make a payment a while ago and its still pending, Why is it taking so long?",pending_card_payment
5248,There is a payment that i made that i noticed has not gone thru yet. Can i ask why?,pending_card_payment
5249,"My card payment is just showing up as pending and it has been a while , what's going on with that, it should be going through at some point?",pending_card_payment
5250,How long will my payment be pending?,pending_card_payment
5251,"My phone was stolen, what should I do first?",lost_or_stolen_phone
5252,"My phone was stolen, what should I do?",lost_or_stolen_phone
5253,"I lost my phone, what should I do?",lost_or_stolen_phone
5254,"Someone has stolen my phone, what should I do?",lost_or_stolen_phone
5255,I think I lost my phone.  Is there a way to prevent anyone from getting into my account on it?,lost_or_stolen_phone
5256,My phone was stolen! What do I need to do?,lost_or_stolen_phone
5257,Can I use the app without my phone?,lost_or_stolen_phone
5259,"Someone stole my phone, what is my next step?",lost_or_stolen_phone
5260,"I forgot my phone at the hotel, so I can't access the app.",lost_or_stolen_phone
5261,"Help, my phone was stolen, please advise!",lost_or_stolen_phone
5262,my phone was lost,lost_or_stolen_phone
5263,I need help- I got mugged yesterday and they took everything so I can't use the app.,lost_or_stolen_phone
5264,I can't find my phone and I'm worried someone is going to use it,lost_or_stolen_phone
5265,I lost my phone! Will my card still work?,lost_or_stolen_phone
5266,I can not find my phone or it has been stolen.,lost_or_stolen_phone
5267,I can't use the app because I got mugged yesterday and they took everything. Please help.,lost_or_stolen_phone
5270,What do I do if I can't access the app?,lost_or_stolen_phone
5271,What do I do if my phone is stolen?,lost_or_stolen_phone
5272,I left my phone somewhere and can't use the app.,lost_or_stolen_phone
